{"evidencePackages":[],"explanationVersions":{},"files":{"bindings.json":"sha256:ab53de781fb2c2a2cf09dd609a61f65464576a39563679208636f5d7070bf9b6","catalog.html":"sha256:e3f855de71514aa7173b3d1a397dc2c66cf83f73580d2d834907faf43a7c985d","diagrams/service-clew-public-workflow-clew-public-workflow-0acc80a387b5f47e328b.puml":"sha256:1365adcae311cffa3b3273c8a5d06e7b623d40705bfdc8f8d474c6bd5dbf40dc","diagrams/service-clew-public-workflow-clew-public-workflow-0acc80a387b5f47e328b.svg":"sha256:4c45092a703d3c0d4334bda93ebd84e54c5209c0f650fee58796cdbc2e6e3308","diagrams/service-clew-public-workflow-clew-public-workflow-11a7847fdafad548b122.puml":"sha256:1cde801c6fcb3a373bb7bb8f88ca737ef9cb0fc36575d62cda2b59d403b4aaae","diagrams/service-clew-public-workflow-clew-public-workflow-11a7847fdafad548b122.svg":"sha256:a791d41ae28596c239de6d5724b06a2e98e46c9d72614f8ca3e786f6cfadf0ac","diagrams/service-clew-public-workflow-clew-public-workflow-3e9a88338b50c1f17975.puml":"sha256:715f443572fbc9811d2dafbd604c614d7f6bae9e7472702ce847e1985c1a846a","diagrams/service-clew-public-workflow-clew-public-workflow-3e9a88338b50c1f17975.svg":"sha256:5e00c5b03bb5059b60d19f0aa11f1dcd4a75f1ad8bfb1fa945b163effc2ca0b2","diagrams/service-clew-public-workflow-clew-public-workflow-4e94ba14682b266f7ef8.puml":"sha256:b3829a2c1ceeb93886cd2532051a93dcd096f9ebd884aca64267708b8c8f334e","diagrams/service-clew-public-workflow-clew-public-workflow-4e94ba14682b266f7ef8.svg":"sha256:43a437f05d16057960538a67e7cba7add34d086909ec0eb72d65b13b1322d99a","diagrams/service-clew-public-workflow-clew-public-workflow-5b7a6fc56854bd748d79.puml":"sha256:cecdf9e9554a1621213fd8c0b5c8d59bd3e5663a5090e7c255368e2dcd0a7763","diagrams/service-clew-public-workflow-clew-public-workflow-5b7a6fc56854bd748d79.svg":"sha256:c463e424f00419b600cdcfa06ba08950aea085330f9a0d614a2e6875027c71da","diagrams/service-clew-public-workflow-clew-public-workflow-5be104cfadcf253f3310.puml":"sha256:8495f6ee811ed4c7fe6bf6a2dac083d74194a3ca5c9a50a7f486b507f5bc7e6c","diagrams/service-clew-public-workflow-clew-public-workflow-5be104cfadcf253f3310.svg":"sha256:57e2ef6123e9f5938e94eb263a8e2e4e9d20534af978f2ac9b6759e5fb1fdfad","diagrams/service-clew-public-workflow-clew-public-workflow-69e80ad8809db9ab9864.puml":"sha256:3aa5ef8349ef04c8af32edeff8961f9519dc1905061f50014076a26ab9e8ec1e","diagrams/service-clew-public-workflow-clew-public-workflow-69e80ad8809db9ab9864.svg":"sha256:e5414f5002aa50fd8c61832d14abd0f8283797c85a8ee017b82f413f18ce607f","diagrams/service-clew-public-workflow-clew-public-workflow-7b7904b8c07893dc914d.puml":"sha256:7ac1aff1310c7e42a7e72f0df65869c2106fc5e9e02de69deded015791844eba","diagrams/service-clew-public-workflow-clew-public-workflow-7b7904b8c07893dc914d.svg":"sha256:0ff87fec771f9c2c00fc93af52d2ced02e3881927e9853d71400be4ab224c9b7","diagrams/service-clew-public-workflow-clew-public-workflow-a68fb9be44ec87fadbe2.puml":"sha256:7afb250281d1bcea5274a26471523945a88a36adde369acc3418945c6f8bc334","diagrams/service-clew-public-workflow-clew-public-workflow-a68fb9be44ec87fadbe2.svg":"sha256:c9713e6e84e4952c28a23463cbd8aebef5b9388c33d826497a3a0cf687ce4bc9","diagrams/service-clew-public-workflow-clew-public-workflow-b4376eab32aa5315c108.puml":"sha256:5925c6c7c48944bde2f16f9b86fde639e154cce47ef6e9d8234a325cdb1fcef3","diagrams/service-clew-public-workflow-clew-public-workflow-b4376eab32aa5315c108.svg":"sha256:1f5e9f88dfb086a4c7e5f7feb126c797ef358aeade931a754843e798433d2ff4","diagrams/service-clew-public-workflow-clew-public-workflow-c1e42fad75554a96627c.puml":"sha256:982bea69d8310e9ab07e81b8ce79df0872d1be8a9b3a4410cb046460a1c42acb","diagrams/service-clew-public-workflow-clew-public-workflow-c1e42fad75554a96627c.svg":"sha256:102c2a31edca6e123bd0fbaf9fd8f700718e4e556553935b34d822ee6da4d0af","diagrams/service-clew-public-workflow-clew-public-workflow-c87aaf89860add1a3f1a.puml":"sha256:52e9ab66f53b05997c13e048ecff1a86f4fae7c47734f9f3cad422d7eae07b87","diagrams/service-clew-public-workflow-clew-public-workflow-c87aaf89860add1a3f1a.svg":"sha256:49f1e0642b1d7899057b8be463214c1a23e51c1c1548c2589eb8c8181dc41a88","diagrams/service-clew-public-workflow-clew-public-workflow-d0d8b869a75d8a66a08e.puml":"sha256:fca0bc8b67c4c3ec584a8bb66640115ad940f95b120fd99021469112f870c81a","diagrams/service-clew-public-workflow-clew-public-workflow-d0d8b869a75d8a66a08e.svg":"sha256:8daf86a81bd16f186765835bf3a510f243b321436167cce1c33b91ca50539ccf","diagrams/service-clew-public-workflow-clew-public-workflow-f10c7bc7b8d207312793.puml":"sha256:798bf65730aaaa8ff6d0c84f26aab495ef3775ed7a14d9cb766a7d1268d99b8e","diagrams/service-clew-public-workflow-clew-public-workflow-f10c7bc7b8d207312793.svg":"sha256:fac481c92fc5eab5fba14fd5ac92b5d81eb32f5c58115869bbd1ba52e76e9f06","help.html":"sha256:789ac280fb7433ed32b84d2595e39cbf240f150107fcdb2bcaac661956320aee","inputs.json":"sha256:645e48e5b115715203cef1b987c092a4f350f249af9558b0b1393a2c172e216f","overview.html":"sha256:c0bdb4f603ad42cd4f33ac6c0405bf71a308f45bbd0044445c7db042534e5902","root-overview.html":"sha256:205ae1c51dc3001730d4947d385e635fe5d2234770d0117fd32fd22a7243f439","runbooks.html":"sha256:98560f0daec5f93e2d6993a4c3f95cac015faf33ced8c1e73a5a23cd0df50ee6","services/clew-public-workflow.html":"sha256:41c84c9e9d2d3c0f197d5946b8c2ea6c0f272fa8d39ae4d5c17889575608d7d9","services/clew-public-workflow.json":"sha256:dcb14857280ca91885599aea6fa8c2e27142469942c4e05c4517d83217b69f3b","services/clew-public-workflow.md":"sha256:32b26e9725fa7425d35a3c8b596253c7704b1f45c0cc68551096004299adb04c","status.json":"sha256:1924081b2dc3e8329b04cebf3948612d9b402b1f380f26cbe6eb9cdd4e997b19"},"id":"aa52cab18cfee37429a7a2664f9039b31457a9952a6f649f554a3be1a4648577","inputDigest":"sha256:9b31bc92726ce9481329e3a7de70d38ea8b2fface3881597846fe25680b8a4e7","observedTags":{},"ordinal":0,"parent":null,"released":false,"schema":"codeclew-documentation-publication/1.0","sections":{"service:clew-public-workflow":{"contentRevisions":{"clew-public-workflow":"fd82a763fb5b38083fc3f298aee5ee116c906e21"},"coverage":{"clew-public-workflow":{"boundaries":["AMBIGUOUS_SOURCE_DETAIL","CALL_TARGETS_UNRESOLVED","DIALECT_DECLARED_NOT_COMPILER_VALIDATED","FILE_ONLY:bootstrap/clew_bootstrap.py","FILE_ONLY:clew","FILE_ONLY:crates/clew/src/documentation/cli.rs","FILE_ONLY:crates/clew/src/main.rs","FILE_ONLY:site/install.sh","ORDER_LEXICAL_ONLY","SCOPE_WATCH_CONSERVATIVE"],"coverage":"SYNTAX"}},"freshness":"UNVERIFIED","reasons":[{"reason":"PINNED_SNAPSHOT_NOT_REVERIFIED","snapshot":"sha256:1bd38a64b1321d30e28e0344e2049678d2f0858d9ef70f67c92580b6d52a4823/9862"}],"targetRevisions":{"clew-public-workflow":"fd82a763fb5b38083fc3f298aee5ee116c906e21"},"verification":"UNASSESSED"}},"targetRevisions":{"clew-public-workflow":"fd82a763fb5b38083fc3f298aee5ee116c906e21"}}