{"documentationLanguage":"en","evidencePackages":[],"explanationVersions":{"service:cli-documentation/section-overview":"sha256:9a0108582b8235aeee1f5cbd238c93e69e8800291133e1c4a06f8147b75d75e9","service:cli-documentation/section-responsibilities":"sha256:107f1b1d3dc8127bcdb0df7faf6ce259cd4afd2928cb7db8306e40d86d551b7f"},"files":{"bindings.json":"sha256:98ad1d192923894338f1bf2d683e9d6d657e2aa0e36cd8b7e0776e0811d1bc49","catalog.html":"sha256:94efb1b631e9c8e179f3b6a405ead9f29396db44734271c85fc1113220052fdb","diagrams/service-cli-documentation-cli-documentation-4c4e5646fc3afe399640.puml":"sha256:c053b7fcc0a0956767c84c44bec5134064fb85463414b751399beea7430815a9","diagrams/service-cli-documentation-cli-documentation-4c4e5646fc3afe399640.svg":"sha256:2cc3bfa69f68fb3cfb5ec94e1d26ef0765310892cff69bc25d41f56df1250914","diagrams/service-cli-documentation-cli-documentation-53b99d0f35fa55badac7.puml":"sha256:4e792b69f0a353d82dc9f82a2cdfa322067d433269b77cdca147fab762b9379e","diagrams/service-cli-documentation-cli-documentation-53b99d0f35fa55badac7.svg":"sha256:59fcc900640ca53199d585e46448c203ec24f602398d8013c27df4748f4923fb","diagrams/service-cli-documentation-cli-documentation-672ee5015ada81ec8d40.puml":"sha256:3bb64f597217ae73f78eba62ca1550a216db0e226214592589420b55cbcd715c","diagrams/service-cli-documentation-cli-documentation-672ee5015ada81ec8d40.svg":"sha256:5895822d04d9d14d02facac37dd7e4b738011caa0cddc1ba8a8ab65369f3d043","diagrams/service-cli-documentation-cli-documentation-6d1878f45ec2b985c9a6.puml":"sha256:2810f89691034c79b1638d543529276659c63e0a1792df390f74e7d07631a930","diagrams/service-cli-documentation-cli-documentation-6d1878f45ec2b985c9a6.svg":"sha256:7bfd74efbb6e78c5e3f12fd9677f5b4f3364f575846edca001efe299b6294d97","diagrams/service-cli-documentation-cli-documentation-7368fc134a99e3cdace1.puml":"sha256:8956b227d952b280de0a4d4203c8593e5a15dbafb7a2c21a3ed4583eb7067b67","diagrams/service-cli-documentation-cli-documentation-7368fc134a99e3cdace1.svg":"sha256:c7c5049c463f0682115e0142cc91bc036a5bdbfad1bfef2d3c7b6c341c9fa4ca","diagrams/service-cli-documentation-section-overview.mmd":"sha256:8df576f43090fff0e0a93b968688431aca5d76ec6b16f9ed1c442f85531f5b76","diagrams/service-cli-documentation-section-responsibilities.mmd":"sha256:35f5c0d9574535290bc545c474118d92f8efddacea4e61237720fc1de45ad403","help.html":"sha256:1981ee92355c7b976bdc56eb69c61387cf49aa13490c34f46f16ccde2d9c7ba8","inputs.json":"sha256:68254b837bdd79f5cf049ac85208d58c71bf5da8c486cdc9b162697a09d34081","overview.html":"sha256:9d6d4546507dd9cb21e4ccc234e2682d2cd9cbac7d8af319451747a750e3cae4","root-overview.html":"sha256:4b46ec48d9531d29c96ac1b640df62a85c50886792d73333330f562cb28e4657","runbooks.html":"sha256:59cf140cb0df75515f4d5a9d63cab6efb35628fbdbdb877bafde06f645d96ac2","services/cli-documentation.html":"sha256:584c6bf5a9dbf50cb5dea8862f1a6451fdcdc24505252e7d3d18a7a19c3f399c","services/cli-documentation.json":"sha256:033ab1fbbd86afa4ad264f23f995df98e2160b10169d832196366b1f2fea596b","services/cli-documentation.md":"sha256:6ece6c68972661f3ea0cd0a87f43f70fc6325cfcb1ebdcc92e5f764b5c58a1b2","status.json":"sha256:3e212732f542d3501d7e7e4da6a327b98e2271f0676eb9a2d943bbe18d916b41"},"id":"0a9a2804909f09fe7b37eba66f0411d7d7f71aea955bdb4f4c6157e3042b240b","inputDigest":"sha256:fbf8f5a0ef043377efb795e12d0b571a11ff29b0051648e02f7134e6703d7303","observedTags":{},"ordinal":2,"parent":"d506eeffe07755b1d40e930899bf828258917c987f0907f8d36ec2beba9892e9","released":true,"schema":"codeclew-documentation-publication/1.0","sections":{"service:cli-documentation":{"contentRevisions":{},"coverage":{"cli-documentation":{"boundaries":["CALL_TARGETS_UNRESOLVED","DIALECT_DECLARED_NOT_COMPILER_VALIDATED","ORDER_LEXICAL_ONLY","SCOPE_WATCH_CONSERVATIVE"],"coverage":"SYNTAX"}},"freshness":"STALE","mixedRevisions":{"cli-documentation":["54597f963f2cadf2ac02e5e48987ab1505111ad8","d91dbec1164e0601d47c221ab97c504033ce858e"]},"reasons":[{"after":"sha256:c80c6051538eb6b0bb9054f370bdc18b5ed1c686a553f86c754ce81bae265bff","before":"sha256:6452be4d5e072648d0bd7265c620eebfc52698d86e6b14b05291eb58204f7467","dependency":"cli-documentation:source_scope:a94d30979421b6ddbba5e94b","reason":"SUPPORTED_BEHAVIOR_CHANGED"},{"reason":"INFLUENCE_SCOPE_CHANGED","scope":"sha256:101c74c3e34a61b481ed9742d485ddbb91e37e1ab10bb281a34b5675f87ad8f1"},{"reason":"PINNED_SNAPSHOT_NOT_REVERIFIED","snapshot":"sha256:76844266ecaf6843e15fe54ff0db45363300f0766abe2cd2aabf0072e0fb9858/4320"}],"targetRevisions":{"cli-documentation":"54597f963f2cadf2ac02e5e48987ab1505111ad8"},"verification":"UNASSESSED"},"service:cli-documentation/section-overview":{"contentRevisions":{"cli-documentation":"54597f963f2cadf2ac02e5e48987ab1505111ad8"},"coverage":{"cli-documentation":{"boundaries":["CALL_TARGETS_UNRESOLVED","DIALECT_DECLARED_NOT_COMPILER_VALIDATED","ORDER_LEXICAL_ONLY","SCOPE_WATCH_CONSERVATIVE"],"coverage":"SYNTAX"}},"freshness":"UNVERIFIED","reasons":[{"reason":"PINNED_SNAPSHOT_NOT_REVERIFIED","snapshot":"sha256:76844266ecaf6843e15fe54ff0db45363300f0766abe2cd2aabf0072e0fb9858/4320"}],"targetRevisions":{"cli-documentation":"54597f963f2cadf2ac02e5e48987ab1505111ad8"},"verification":"UNASSESSED"},"service:cli-documentation/section-responsibilities":{"contentRevisions":{"cli-documentation":"d91dbec1164e0601d47c221ab97c504033ce858e"},"coverage":{"cli-documentation":{"boundaries":["CALL_TARGETS_UNRESOLVED","DIALECT_DECLARED_NOT_COMPILER_VALIDATED","ORDER_LEXICAL_ONLY","SCOPE_WATCH_CONSERVATIVE"],"coverage":"SYNTAX"}},"freshness":"STALE","reasons":[{"after":"sha256:c80c6051538eb6b0bb9054f370bdc18b5ed1c686a553f86c754ce81bae265bff","before":"sha256:6452be4d5e072648d0bd7265c620eebfc52698d86e6b14b05291eb58204f7467","dependency":"cli-documentation:source_scope:a94d30979421b6ddbba5e94b","reason":"SUPPORTED_BEHAVIOR_CHANGED"},{"reason":"INFLUENCE_SCOPE_CHANGED","scope":"sha256:101c74c3e34a61b481ed9742d485ddbb91e37e1ab10bb281a34b5675f87ad8f1"},{"reason":"PINNED_SNAPSHOT_NOT_REVERIFIED","snapshot":"sha256:76844266ecaf6843e15fe54ff0db45363300f0766abe2cd2aabf0072e0fb9858/4320"}],"targetRevisions":{"cli-documentation":"54597f963f2cadf2ac02e5e48987ab1505111ad8"},"verification":"UNASSESSED"}},"targetRevisions":{"cli-documentation":"54597f963f2cadf2ac02e5e48987ab1505111ad8"}}