{"documentationLanguage":"en","evidencePackages":[],"explanationVersions":{"service:cli-documentation/section-overview":"sha256:3eb054804db882e353ea8522945f2804baf5ddb59d56a7204bcb7ed9c4de5b0d"},"files":{"bindings.json":"sha256:660e52152310d317683ca0e92ea16640edb5c0dbdd2c957fcbf766d593555790","catalog.html":"sha256:f95d73f31e83b8d826cae36874525a3de25ec6696d11902bff6c9c8f0695bd07","diagrams/service-cli-documentation-cli-documentation-4c4e5646fc3afe399640.puml":"sha256:c053b7fcc0a0956767c84c44bec5134064fb85463414b751399beea7430815a9","diagrams/service-cli-documentation-cli-documentation-4c4e5646fc3afe399640.svg":"sha256:2cc3bfa69f68fb3cfb5ec94e1d26ef0765310892cff69bc25d41f56df1250914","diagrams/service-cli-documentation-cli-documentation-53b99d0f35fa55badac7.puml":"sha256:4e792b69f0a353d82dc9f82a2cdfa322067d433269b77cdca147fab762b9379e","diagrams/service-cli-documentation-cli-documentation-53b99d0f35fa55badac7.svg":"sha256:59fcc900640ca53199d585e46448c203ec24f602398d8013c27df4748f4923fb","diagrams/service-cli-documentation-cli-documentation-672ee5015ada81ec8d40.puml":"sha256:3bb64f597217ae73f78eba62ca1550a216db0e226214592589420b55cbcd715c","diagrams/service-cli-documentation-cli-documentation-672ee5015ada81ec8d40.svg":"sha256:5895822d04d9d14d02facac37dd7e4b738011caa0cddc1ba8a8ab65369f3d043","diagrams/service-cli-documentation-cli-documentation-6d1878f45ec2b985c9a6.puml":"sha256:2810f89691034c79b1638d543529276659c63e0a1792df390f74e7d07631a930","diagrams/service-cli-documentation-cli-documentation-6d1878f45ec2b985c9a6.svg":"sha256:7bfd74efbb6e78c5e3f12fd9677f5b4f3364f575846edca001efe299b6294d97","diagrams/service-cli-documentation-cli-documentation-7368fc134a99e3cdace1.puml":"sha256:8956b227d952b280de0a4d4203c8593e5a15dbafb7a2c21a3ed4583eb7067b67","diagrams/service-cli-documentation-cli-documentation-7368fc134a99e3cdace1.svg":"sha256:c7c5049c463f0682115e0142cc91bc036a5bdbfad1bfef2d3c7b6c341c9fa4ca","diagrams/service-cli-documentation-section-overview.mmd":"sha256:8df576f43090fff0e0a93b968688431aca5d76ec6b16f9ed1c442f85531f5b76","help.html":"sha256:9086e80e1b13861ea0685f5c33c4277e615d99c1f6a8ff4e14aaed15c892baff","inputs.json":"sha256:fad6bbb666c0531b14898f0a9709166d7cc718dbfc17bd28faedb72d054b13ea","overview.html":"sha256:1f69cadad79d6bb17695e38786edc9ff3fe3d38a6c5f6c4e14c7524282f9c83a","root-overview.html":"sha256:bdbe0f4d36a17827f5cb558d0e213e068bfb052bc7954a6a53e578df176e24d8","runbooks.html":"sha256:e8669a9b0a62bd7617481af740526fa1c6a9ccbff4f66007545070f0db758831","services/cli-documentation.html":"sha256:47c86e96fa6c14353271f498d72e7964d546e420dd279a16ebed79e5d2c63887","services/cli-documentation.json":"sha256:ae4fcce6409dce55830039652943e479fa180c0d8209c35ae190ea30ab078fea","services/cli-documentation.md":"sha256:38cf8fa585724ee7a602ed9d8e798c6eb779881917e57254d1e048d3c565711a","status.json":"sha256:563e01faec23853a916645f8c0aca17cf78fbd74994aa6ec19c2f6dae204f855"},"id":"bf1cf2b887bd2cd30062cc00d6da3ac18722ddd76f8310d1df1006f37f7310ab","inputDigest":"sha256:ba8c32301a10195e202e315270326dfd14af194b0bdb2cb2642f198baa605bc0","observedTags":{},"ordinal":0,"parent":null,"released":false,"schema":"codeclew-documentation-publication/1.0","sections":{"service:cli-documentation":{"contentRevisions":{"cli-documentation":"d91dbec1164e0601d47c221ab97c504033ce858e"},"coverage":{"cli-documentation":{"boundaries":["CALL_TARGETS_UNRESOLVED","DIALECT_DECLARED_NOT_COMPILER_VALIDATED","ORDER_LEXICAL_ONLY","SCOPE_WATCH_CONSERVATIVE"],"coverage":"SYNTAX"}},"freshness":"UNVERIFIED","reasons":[{"reason":"PINNED_SNAPSHOT_NOT_REVERIFIED","snapshot":"sha256:5a9c13cb5716f6ebe4256541028e4104b5e5ba0ed6a9b26480c20a4dceb33a24/4319"}],"targetRevisions":{"cli-documentation":"d91dbec1164e0601d47c221ab97c504033ce858e"},"verification":"UNASSESSED"},"service:cli-documentation/section-overview":{"contentRevisions":{"cli-documentation":"d91dbec1164e0601d47c221ab97c504033ce858e"},"coverage":{"cli-documentation":{"boundaries":["CALL_TARGETS_UNRESOLVED","DIALECT_DECLARED_NOT_COMPILER_VALIDATED","ORDER_LEXICAL_ONLY","SCOPE_WATCH_CONSERVATIVE"],"coverage":"SYNTAX"}},"freshness":"UNVERIFIED","reasons":[{"reason":"PINNED_SNAPSHOT_NOT_REVERIFIED","snapshot":"sha256:5a9c13cb5716f6ebe4256541028e4104b5e5ba0ed6a9b26480c20a4dceb33a24/4319"}],"targetRevisions":{"cli-documentation":"d91dbec1164e0601d47c221ab97c504033ce858e"},"verification":"UNASSESSED"}},"targetRevisions":{"cli-documentation":"d91dbec1164e0601d47c221ab97c504033ce858e"}}