{"documentationLanguage":"en","evidencePackages":[],"explanationVersions":{"service:clew-starter/section-overview":"sha256:70b1b7f66c87c4dfd112c639ffcb78d6add895a8b2ab5239634de4cb4a287c82"},"files":{"bindings.json":"sha256:5696a6611f8dd7e3395a4ff262c4ede926b6d0d0d3205f72012b9f418947d41b","catalog.html":"sha256:7959d478ef54581c3e085430fb844e30c6e115d4171854f5c638c6a3760f6ec9","diagrams/service-clew-starter-clew-starter-02de0c5cdf817561e88f.puml":"sha256:47aac1976ced33855c95a1410e1ec6f4634bb165547360e2aa80d90138df7a0b","diagrams/service-clew-starter-clew-starter-02de0c5cdf817561e88f.svg":"sha256:884238a44ad7eb162554a0015c17319a24c22b1743b087f960a72aa8ca8ccf52","diagrams/service-clew-starter-clew-starter-4d50b7d214ab5825e94e.puml":"sha256:5a14a5e876f82e438c118b00c93f6210132bdcb20f283d4ebcc702fd411c583a","diagrams/service-clew-starter-clew-starter-4d50b7d214ab5825e94e.svg":"sha256:441b69681bd14047ee6c0701c069ffbbba2935971d5aff21766a15c61664e44c","diagrams/service-clew-starter-clew-starter-77171a2c23d3c904bbc3.puml":"sha256:36d0bb71459d37ce6b4c1bf3c0c132ef9308d521b373bdb0e646171403c93475","diagrams/service-clew-starter-clew-starter-77171a2c23d3c904bbc3.svg":"sha256:6dbfe552da6f36bd2750cc87797d06bbed23b92894c4f636f031d568f4a93f59","diagrams/service-clew-starter-clew-starter-7d32f25e97fa2d3bbe07.puml":"sha256:d7c83849af2223e215096de0d5064e030dd420cdc72e2f4df8c064b3359e9602","diagrams/service-clew-starter-clew-starter-7d32f25e97fa2d3bbe07.svg":"sha256:f95d7288e8fbc51c6afa9a217fd1f11539ac0ed7ef8d742a48391207aa77357e","diagrams/service-clew-starter-clew-starter-98ee337a4ff0300a5bba.puml":"sha256:334c69fc77587962f46957a308d8d78bc184467ef1336c4368c13521e47de2f9","diagrams/service-clew-starter-clew-starter-98ee337a4ff0300a5bba.svg":"sha256:21f77b2fe322fb64696345809ce56367e86c9343a996636a134c853efd3653f0","diagrams/service-clew-starter-clew-starter-d7178391b096d3a306c1.puml":"sha256:f3a0f6f1acd4cb08ef97aeaa3858460b2fb4a8372ede465858f093ac7c61939a","diagrams/service-clew-starter-clew-starter-d7178391b096d3a306c1.svg":"sha256:c3a373c88774300083908b4d9e367c646f64b6a13929c15f791868f0c865d01f","diagrams/service-clew-starter-clew-starter-eba9b837de95912d2297.puml":"sha256:ced86df074521ea6d47ef9f9aabd602e6f46b598a8f778c5903f47ecc1245873","diagrams/service-clew-starter-clew-starter-eba9b837de95912d2297.svg":"sha256:e78c9d18f95a881e051f851f7d46f5a89796ae79af06390978e68e03ca085326","diagrams/service-clew-starter-section-overview.mmd":"sha256:8df576f43090fff0e0a93b968688431aca5d76ec6b16f9ed1c442f85531f5b76","help.html":"sha256:9086e80e1b13861ea0685f5c33c4277e615d99c1f6a8ff4e14aaed15c892baff","inputs.json":"sha256:8928bfdfdb2661caa9897b2dd7e7c5b189745399cb4f1ce07c33238690dcc385","overview.html":"sha256:41b73b571fe2265d1322f8d6d8c744c122e1c3c3cdb849a5446e0360db077c6c","root-overview.html":"sha256:e0480d40a5a0ff4c8a49c0d86bd75cea0952b12cec941ccbb0397b7b345bfaf3","runbooks.html":"sha256:e8669a9b0a62bd7617481af740526fa1c6a9ccbff4f66007545070f0db758831","services/clew-starter.html":"sha256:dbfcaf1ed014578e1b7c63b42b14aac69c14556b9e672be0f76ba78f0a48e3eb","services/clew-starter.json":"sha256:30a6c97fec3a72d2c0e410f7e19909e69e624abc3ea720ba4a357a82f0a1de4d","services/clew-starter.md":"sha256:b77e3379ae73ee66ca46db6c9071492ff7908d6dc1863f18e5cc08ebeb17c579","status.json":"sha256:36374dff04a694a828a8a5134ed09a43bb3657c92aa1fc39102e9a3a2b36bfdc"},"id":"fe231260a788793c8125f84cd34c23eaac4a1bec360efd7fd570cf4126d109d0","inputDigest":"sha256:7bf046d78dc91cb9aaed7e163c53f762d576333ecbbd466aba2f21448fccc88b","observedTags":{},"ordinal":0,"parent":null,"released":false,"schema":"codeclew-documentation-publication/1.0","sections":{"service:clew-starter":{"contentRevisions":{"clew-starter":"b810c1aa5c9765f3056f763a8367c57de070e7ba"},"coverage":{"clew-starter":{"boundaries":["CALL_TARGETS_UNRESOLVED","DIALECT_DECLARED_NOT_COMPILER_VALIDATED","ORDER_LEXICAL_ONLY","SCOPE_WATCH_CONSERVATIVE"],"coverage":"SYNTAX"}},"freshness":"UNVERIFIED","reasons":[{"reason":"PINNED_SNAPSHOT_NOT_REVERIFIED","snapshot":"sha256:465efa03cea3c980d78078b6ea55fbf16836fa1ddb555804077fc8fb41c708cf/5736"}],"targetRevisions":{"clew-starter":"b810c1aa5c9765f3056f763a8367c57de070e7ba"},"verification":"UNASSESSED"},"service:clew-starter/section-overview":{"contentRevisions":{"clew-starter":"b810c1aa5c9765f3056f763a8367c57de070e7ba"},"coverage":{"clew-starter":{"boundaries":["CALL_TARGETS_UNRESOLVED","DIALECT_DECLARED_NOT_COMPILER_VALIDATED","ORDER_LEXICAL_ONLY","SCOPE_WATCH_CONSERVATIVE"],"coverage":"SYNTAX"}},"freshness":"UNVERIFIED","reasons":[{"reason":"PINNED_SNAPSHOT_NOT_REVERIFIED","snapshot":"sha256:465efa03cea3c980d78078b6ea55fbf16836fa1ddb555804077fc8fb41c708cf/5736"}],"targetRevisions":{"clew-starter":"b810c1aa5c9765f3056f763a8367c57de070e7ba"},"verification":"UNASSESSED"}},"targetRevisions":{"clew-starter":"b810c1aa5c9765f3056f763a8367c57de070e7ba"}}